{
  "schema": "ev4-unit-strategy-check@0.1.0",
  "control": "Width",
  "proposed_value": 480,
  "proposed_unit": "px",
  "value_source": "temporary_calibration",
  "responsive_scope": "desktop_only",
  "affects_layout": true,
  "affects_position": false,
  "risk_level": "high",
  "reversible": true,
  "safe_to_emit": true,
  "reason": "Desktop-only reversible calibration after unit strategy was explicitly confirmed; it does not claim responsive behavior.",
  "required_next_action": "emit_value"
}
